Tweet,Orig_Label,Vote,label
Beats by Dr. Dre urBeats Wired In-Ear Headphones - White https://t.co/9tREpqfyW4 https://t.co/FCaWyWRbpE,spam,4,False
RT @Papapishu: Man it would fucking rule if we had a party that was against perpetual warfare.,abusive,4,False
"It is time to draw close to Him &#128591;&#127995; Father, I draw near to you now and always ❤️ https://t.co/MVRBBX2aqJ",normal,4,False
if you notice me start to act different or distant.. it's bc i peeped something you did or i notice a difference in how you act &amp; ian fw it.,normal,5,False
"Forget unfollowers, I believe in growing. 7 new followers in the last day! Stats via https://t.co/bunPHQNXhj",normal,3,False
RT @Vitiligoprince: Hate Being sexually Frustrated Like I wanna Fuck But ion wanna Just fuck anybody,abusive,4,False
Topped the group in TGP Disc Jam Season 2! Onto the Semi-Finals! @HighHorseGames https://t.co/N7LE8lX7Rm,normal,3,False
That daily baby aspirin for your #heart just might be preventing colon #cancer too. https://t.co/2TLawmHhEe,normal,5,False
I liked a @YouTube video from @mattshea https://t.co/niSeJrLKHq THE BLUE ARMY IS COMING! - Ancient Warfare 2,normal,2,False
